{
  "$schema": "https://json-schema.org/draft/2020-12/schema",
  "$id": "https://spec-driven.local/format/v2/manifest.schema.json",
  "title": "Manifest",
  "type": "object",
  "required": ["format","title","artifacts","tests_root","glossary"],
  "additionalProperties": false,
  "properties": {
    "format": {"const":"2","x-spec-ref":false,"x-spec-ref-reason":"Closed format selector; no dependency identity.","x-spec-exclusion":{"category":"enum-literal"}},
    "title": {"type":"string","minLength":1,"maxLength":80,"x-spec-ref":false,"x-spec-ref-reason":"Literal title value; no reference namespace or dependency join.","x-spec-exclusion":{"category":"free-text"}},
    "language": {"type":"string","maxLength":40,"x-spec-ref":false,"x-spec-ref-reason":"Literal language value; no reference namespace or dependency join.","x-spec-exclusion":{"category":"free-text"}},
    "date": {"type":"string","pattern":"^\\d{4}-\\d{2}-\\d{2}$","format":"date","x-spec-ref":false,"x-spec-ref-reason":"Timestamp/date value, not a dependency identity.","x-spec-exclusion":{"category":"format-value"}},
    "changes": {"type":"object","additionalProperties":false,"properties":{"recent_days":{"type":"integer","minimum":0,"maximum":36500},"locale":{"type":"string","enum":["en","vi"],"x-spec-ref":false,"x-spec-ref-reason":"Closed locale selector; no dependency identity.","x-spec-exclusion":{"category":"enum-literal"}},"blocks":{"type":"string","minLength":1,"pattern":"^(?!/)(?!.*(?:^|/)\\.\\.(?:/|$))(?!.*\\\\)(?![A-Za-z][A-Za-z0-9+.-]*:)[^\\s#]+\\.json$","x-spec-ref":"manifest-changes-blocks"}}},
    "artifacts": {
      "type": "array",
      "minItems": 1,
      "items": {
        "type": "object",
        "required": ["id","name"],
        "additionalProperties": false,
        "properties": {
          "id": {"type":"string","pattern":"^[a-z][a-z0-9-]*$","x-spec-ref":"manifest-artifacts-id"},
          "n": {"type":"integer","minimum":1},
          "name": {"type":"string","minLength":1,"maxLength":80,"x-spec-ref":false,"x-spec-ref-reason":"Literal name value; no reference namespace or dependency join.","x-spec-exclusion":{"category":"free-text"}},
          "folder": {"type":"string","pattern":"^[A-Za-z0-9][A-Za-z0-9_-]*$","x-spec-ref":"manifest-artifacts-folder"},
          "status": {"type":"string","maxLength":60,"x-spec-ref":false,"x-spec-ref-reason":"Literal status value; no reference namespace or dependency join.","x-spec-exclusion":{"category":"free-text"}},
          "owner_role": {"type":"string","maxLength":60,"x-spec-ref":false,"x-spec-ref-reason":"Actor identity/role, not an artifact dependency.","x-spec-exclusion":{"category":"free-text"}}
        }
      }
    },
    "tiers": {
      "type": "array",
      "items": {
        "type": "object",
        "required": ["id","name"],
        "additionalProperties": false,
        "properties": {
          "id": {"type":"string","pattern":"^[a-z][a-z0-9-]*$","x-spec-ref":"manifest-tiers-id"},
          "name": {"type":"string","minLength":1,"x-spec-ref":false,"x-spec-ref-reason":"Literal name value; no reference namespace or dependency join.","x-spec-exclusion":{"category":"free-text"}},
          "audience": {"type":"string","x-spec-ref":false,"x-spec-ref-reason":"Literal audience value; no reference namespace or dependency join.","x-spec-exclusion":{"category":"free-text"}},
          "status": {"type":"string","x-spec-ref":false,"x-spec-ref-reason":"Literal status value; no reference namespace or dependency join.","x-spec-exclusion":{"category":"free-text"}},
          "purpose": {"type":"string","x-spec-ref":false,"x-spec-ref-reason":"Literal purpose value; no reference namespace or dependency join.","x-spec-exclusion":{"category":"free-text"}}
        }
      }
    },
    "tier_by_type": {
      "type": "object",
      "additionalProperties": {"type":"string","pattern":"^[a-z][a-z0-9-]*$","x-spec-ref":"manifest-tier-by-type"},
      "propertyNames": {"enum":["overview","intake","contract","prd","us-index","us","release","epic","readable-review","ux","wireframe-index","build","review","decisions","note","ui-contract","glossary","screen-inventory","change-set"],"x-spec-ref":false,"x-spec-ref-reason":"Closed propertyNames selector; no dependency identity.","x-spec-exclusion":{"category":"enum-literal"}},
      "x-spec-ref": false,
      "x-spec-ref-reason": "Literal tier_by_type value; no reference namespace or dependency join."
    ,"x-spec-exclusion":{"category":"container-of","owner":"manifest.schema.json#/properties/tier_by_type/propertyNames"}},
    "readable": {
      "type": "object",
      "additionalProperties": false,
      "properties": {
        "epics": {"type":"object","additionalProperties":false,"properties":{"min":{"type":"integer","minimum":0},"max":{"type":"integer","minimum":1}}},
        "capabilities": {"type":"object","additionalProperties":false,"properties":{"min":{"type":"integer","minimum":0},"max":{"type":"integer","minimum":1}}},
        "check": {
          "type": "object",
          "required": [],
          "additionalProperties": false,
          "properties": {
            "sections": {
              "type": "object",
              "required": [],
              "additionalProperties": false,
              "properties": {
                "page": {"type":"array","minItems":1,"uniqueItems":true,"items":{"type":"string","minLength":1,"x-spec-ref":false,"x-spec-ref-reason":"Literal items value; no reference namespace or dependency join.","x-spec-exclusion":{"category":"free-text"}},"x-spec-ref":false,"x-spec-ref-reason":"Presentation heading strings customize readable sections; they are not page ids or source paths.","x-spec-exclusion":{"category":"container-of","owner":"manifest.schema.json#/properties/readable/properties/check/properties/sections/properties/page/items"}},
                "block": {"type":"array","minItems":1,"uniqueItems":true,"items":{"type":"string","minLength":1,"x-spec-ref":false,"x-spec-ref-reason":"Literal items value; no reference namespace or dependency join.","x-spec-exclusion":{"category":"free-text"}}},
                "release": {"type":"array","minItems":1,"uniqueItems":true,"items":{"type":"string","minLength":1,"x-spec-ref":false,"x-spec-ref-reason":"Literal items value; no reference namespace or dependency join.","x-spec-exclusion":{"category":"free-text"}}},
                "scope": {"type":"string","minLength":1,"x-spec-ref":false,"x-spec-ref-reason":"Literal scope value; no reference namespace or dependency join.","x-spec-exclusion":{"category":"free-text"}},
                "releaseScope": {"type":"string","minLength":1,"x-spec-ref":false,"x-spec-ref-reason":"Literal releaseScope value; no reference namespace or dependency join.","x-spec-exclusion":{"category":"free-text"}},
                "buildDetail": {"type":"string","minLength":1,"x-spec-ref":false,"x-spec-ref-reason":"Literal buildDetail value; no reference namespace or dependency join.","x-spec-exclusion":{"category":"free-text"}},
                "ac": {"type":"string","minLength":1,"x-spec-ref":false,"x-spec-ref-reason":"Literal ac value; no reference namespace or dependency join.","x-spec-exclusion":{"category":"free-text"}},
                "acHeader": {"type":"string","minLength":1,"x-spec-ref":false,"x-spec-ref-reason":"Literal acHeader value; no reference namespace or dependency join.","x-spec-exclusion":{"category":"free-text"}},
                "acEmpty": {"type":"string","minLength":1,"x-spec-ref":false,"x-spec-ref-reason":"Literal acEmpty value; no reference namespace or dependency join.","x-spec-exclusion":{"category":"free-text"}}
              }
            },
            "backlogStatus": {"type":"string","minLength":1,"x-spec-ref":false,"x-spec-ref-reason":"Literal backlogStatus value; no reference namespace or dependency join.","x-spec-exclusion":{"category":"free-text"}}
          }
        },
        "direct_groups": {"type":"array","uniqueItems":true,"items":{"type":"string","pattern":"^BRD-[1-9][0-9]*$","x-spec-ref":"manifest-readable-direct-groups"},"x-spec-ref":false,"x-spec-ref-reason":"Literal direct_groups value; no reference namespace or dependency join.","x-spec-exclusion":{"category":"container-of","owner":"manifest.schema.json#/properties/readable/properties/direct_groups/items"}}
      }
    },
    "images": {"type":"object","additionalProperties":false,"properties":{"deny":{"type":"array","minItems":0,"uniqueItems":true,"items":{"type":"string","minLength":1,"pattern":"^(?!/)(?!.*(?:^|/)\\.\\.(?:/|$))(?!.*\\\\)(?![A-Za-z][A-Za-z0-9+.-]*:)[^\\s#]+$","x-spec-ref":"manifest-images-deny"},"x-spec-ref":false,"x-spec-ref-reason":"Literal deny value; no reference namespace or dependency join.","x-spec-exclusion":{"category":"container-of","owner":"manifest.schema.json#/properties/images/properties/deny/items"}}}},
    "theme": {"type":"object","additionalProperties":false,"properties":{"tokens":{"type":"string","minLength":1,"pattern":"^(?!/)(?!.*(?:^|/)\\.\\.(?:/|$))(?!.*\\\\)(?![A-Za-z][A-Za-z0-9+.-]*:)[^\\s#]+$","x-spec-ref":"manifest-theme-tokens"}}},
    "reading_order": {"type":"array","items":{"type":"object","required":["pages"],"additionalProperties":false,"properties":{"pages":{"type":"array","minItems":1,"items":{"type":"string","x-spec-ref":"manifest-reading-order-pages"},"x-spec-ref":false,"x-spec-ref-reason":"Literal pages value; no reference namespace or dependency join.","x-spec-exclusion":{"category":"container-of","owner":"manifest.schema.json#/properties/reading_order/items/properties/pages/items"}},"note":{"type":"string","x-spec-ref":false,"x-spec-ref-reason":"Literal note value; no reference namespace or dependency join.","x-spec-exclusion":{"category":"free-text"}}}}},
    "tests_root": {"type":"string","minLength":1,"pattern":"^(?!/)(?!.*(?:^|/)\\.\\.(?:/|$))(?!.*\\\\)(?![A-Za-z][A-Za-z0-9+.-]*:)[^\\s#]+$","x-spec-ref":"manifest-tests-root"},
    "glossary": {
      "type": "object",
      "required": [],
      "additionalProperties": false,
      "properties": {"document":{"type":"string","minLength":1,"pattern":"^(?!/)(?!.*(?:^|/)\\.\\.(?:/|$))(?!.*\\\\)(?![A-Za-z][A-Za-z0-9+.-]*:)[^\\s#]+\\.md$","x-spec-ref":"manifest-glossary-document"},"context":{"type":"string","minLength":1,"pattern":"^(?!/)(?!.*(?:^|/)\\.\\.(?:/|$))(?!.*\\\\)(?![A-Za-z][A-Za-z0-9+.-]*:)[^\\s#]+\\.md$","x-spec-ref":"manifest-glossary-context"}},
      "anyOf": [{"required":["document"],"type":"object","properties":{"document":{"x-spec-ref":false,"x-spec-ref-reason":"Constraint refinement; extraction belongs to the owning field.","x-spec-exclusion":{"category":"refinement-of","owner":"manifest.schema.json#/properties/glossary/properties/document"}}}},{"required":["context"],"type":"object","properties":{"context":{"x-spec-ref":false,"x-spec-ref-reason":"Constraint refinement; extraction belongs to the owning field.","x-spec-exclusion":{"category":"refinement-of","owner":"manifest.schema.json#/properties/glossary/properties/context"}}}}]
    },
    "ui_contract": {"enum":["optional","required","legacy-absent"],"x-spec-ref":false,"x-spec-ref-reason":"Closed ui_contract selector; no dependency identity.","x-spec-exclusion":{"category":"enum-literal"}},
    "migrated_from": {"const":"v1","x-spec-ref":false,"x-spec-ref-reason":"Closed migrated_from selector; no dependency identity.","x-spec-exclusion":{"category":"enum-literal"}},
    "migration_report": {"type":"string","minLength":1,"pattern":"^(?!/)(?!.*(?:^|/)\\.\\.(?:/|$))(?!.*\\\\)(?![A-Za-z][A-Za-z0-9+.-]*:)[^\\s#]+\\.json$","x-spec-ref":"manifest-migration-report"},
    "design": {
      "type": "object",
      "additionalProperties": false,
      "properties": {
        "profile": {"type":"string","minLength":1,"pattern":"^(?!/)(?!.*(?:^|/)\\.\\.(?:/|$))(?!.*\\\\)(?![A-Za-z][A-Za-z0-9+.-]*:)[^\\s#]+$","x-spec-ref":"manifest-design-profile"},
        "inventory": {"type":"string","minLength":1,"pattern":"^(?!/)(?!.*(?:^|/)\\.\\.(?:/|$))(?!.*\\\\)(?![A-Za-z][A-Za-z0-9+.-]*:)[^\\s#]+$","x-spec-ref":"manifest-design-inventory"},
        "sources": {"type":"string","minLength":1,"pattern":"^(?!/)(?!.*(?:^|/)\\.\\.(?:/|$))(?!.*\\\\)(?![A-Za-z][A-Za-z0-9+.-]*:)[^\\s#]+$","x-spec-ref":"manifest-design-sources"},
        "evidence": {"type":"array","items":{"type":"string","minLength":1,"pattern":"^(?!/)(?!.*(?:^|/)\\.\\.(?:/|$))(?!.*\\\\)(?![A-Za-z][A-Za-z0-9+.-]*:)[^\\s#]+$","x-spec-ref":"manifest-design-evidence"},"minItems":0,"uniqueItems":true,"x-spec-ref":false,"x-spec-ref-reason":"Literal evidence value; no reference namespace or dependency join.","x-spec-exclusion":{"category":"container-of","owner":"manifest.schema.json#/properties/design/properties/evidence/items"}}
      },
      "required": ["profile","inventory"]
    },
    "gate_model": {
      "type": "object",
      "additionalProperties": false,
      "properties": {
        "graph": {"type":"string","minLength":1,"pattern":"^(?!/)(?!.*(?:^|/)\\.\\.(?:/|$))(?!.*\\\\)(?![A-Za-z][A-Za-z0-9+.-]*:)[^\\s#]+$","x-spec-ref":"manifest-gate-model-graph"},
        "changes": {"type":"array","items":{"type":"string","minLength":1,"pattern":"^(?!/)(?!.*(?:^|/)\\.\\.(?:/|$))(?!.*\\\\)(?![A-Za-z][A-Za-z0-9+.-]*:)[^\\s#]+$","x-spec-ref":"manifest-gate-model-changes"},"minItems":0,"uniqueItems":true,"x-spec-ref":false,"x-spec-ref-reason":"Literal changes value; no reference namespace or dependency join.","x-spec-exclusion":{"category":"container-of","owner":"manifest.schema.json#/properties/gate_model/properties/changes/items"}},
        "receipts": {"type":"array","items":{"type":"string","minLength":1,"pattern":"^(?!/)(?!.*(?:^|/)\\.\\.(?:/|$))(?!.*\\\\)(?![A-Za-z][A-Za-z0-9+.-]*:)[^\\s#]+$","x-spec-ref":"manifest-gate-model-receipts"},"minItems":0,"uniqueItems":true,"x-spec-ref":false,"x-spec-ref-reason":"Literal receipts value; no reference namespace or dependency join.","x-spec-exclusion":{"category":"container-of","owner":"manifest.schema.json#/properties/gate_model/properties/receipts/items"}},
        "records": {"type":"string","minLength":1,"pattern":"^(?!/)(?!.*(?:^|/)\\.\\.(?:/|$))(?!.*\\\\)(?![A-Za-z][A-Za-z0-9+.-]*:)[^\\s#]+$","description":"AM-2: spec-relative directory holding the runner's exported gate records (definitions/, gates/, transitions/, exceptions/, decisions/, packets/, audit.jsonl). Optional; when absent lint reports Q-record checks NOT RUN.","x-spec-ref":"manifest-gate-model-records"}
      },
      "required": ["graph","changes","receipts"]
    }
  },
  "allOf": [
    {
      "if": {"properties":{"ui_contract":{"const":"legacy-absent","x-spec-ref":false,"x-spec-ref-reason":"Constraint refinement; extraction belongs to the owning field.","x-spec-exclusion":{"category":"refinement-of","owner":"manifest.schema.json#/properties/ui_contract"}}},"required":["ui_contract"],"type":"object"},
      "then": {"required":["migrated_from","migration_report"],"type":"object","properties":{"migrated_from":{"x-spec-ref":false,"x-spec-ref-reason":"Constraint refinement; extraction belongs to the owning field.","x-spec-exclusion":{"category":"refinement-of","owner":"manifest.schema.json#/properties/migrated_from"}},"migration_report":{"x-spec-ref":false,"x-spec-ref-reason":"Constraint refinement; extraction belongs to the owning field.","x-spec-exclusion":{"category":"refinement-of","owner":"manifest.schema.json#/properties/migration_report"}}}},
      "x-spec-ref": false,
      "x-spec-ref-reason": "Constraint refinement; extraction belongs to the owning field."
    ,"x-spec-exclusion":{"category":"refinement-of","owner":"manifest.schema.json#"}},
    {"if":{"required":["migrated_from"],"type":"object","properties":{"migrated_from":{"x-spec-ref":false,"x-spec-ref-reason":"Constraint refinement; extraction belongs to the owning field.","x-spec-exclusion":{"category":"refinement-of","owner":"manifest.schema.json#/properties/migrated_from"}}}},"then":{"required":["migration_report"],"type":"object","properties":{"migration_report":{"x-spec-ref":false,"x-spec-ref-reason":"Constraint refinement; extraction belongs to the owning field.","x-spec-exclusion":{"category":"refinement-of","owner":"manifest.schema.json#/properties/migration_report"}}}},"x-spec-ref":false,"x-spec-ref-reason":"Constraint refinement; extraction belongs to the owning field.","x-spec-exclusion":{"category":"refinement-of","owner":"manifest.schema.json#"}},
    {"if":{"required":["migration_report"],"type":"object","properties":{"migration_report":{"x-spec-ref":false,"x-spec-ref-reason":"Constraint refinement; extraction belongs to the owning field.","x-spec-exclusion":{"category":"refinement-of","owner":"manifest.schema.json#/properties/migration_report"}}}},"then":{"required":["migrated_from"],"type":"object","properties":{"migrated_from":{"x-spec-ref":false,"x-spec-ref-reason":"Constraint refinement; extraction belongs to the owning field.","x-spec-exclusion":{"category":"refinement-of","owner":"manifest.schema.json#/properties/migrated_from"}}}},"x-spec-ref":false,"x-spec-ref-reason":"Constraint refinement; extraction belongs to the owning field.","x-spec-exclusion":{"category":"refinement-of","owner":"manifest.schema.json#"}}
  ]
}
