{
  "format": "2",
  "title": "Recorded prototype-first exception",
  "tests_root": "tests",
  "glossary": {
    "document": "glossary.md"
  },
  "ui_contract": "optional",
  "artifacts": [
    {
      "id": "prd",
      "folder": "prd",
      "name": "Requirements"
    },
    {
      "id": "us",
      "folder": "us",
      "name": "Stories"
    }
  ]
}
